{
  "runId": "run-1762702264165",
  "summary": {
    "runId": "run-1762702264165",
    "totalTrades": 0,
    "tradesCount": 0,
    "totalPnL": 0,
    "avgReturn": 0,
    "winRate": 0,
    "profitFactor": 0,
    "maxDrawdown": 0,
    "avgHoldingDays": 0,
    "missingCount": 1,
    "from": "2025-01-01",
    "to": "2025-01-02",
    "interval": "day",
    "mode": "mock",
    "strategyConfig": {
      "a": 1,
      "b": 1,
      "c": 2
    },
    "swing10": {
      "successWithin10Days": 0,
      "failWithin10Days": 0,
      "expiredTrades": 0,
      "successRateWithin10Days": 0
    },
    "equityCurve": []
  },
  "perSymbol": {
    "X": {
      "trades": [],
      "metrics": {
        "netPnl": 0,
        "winRate": 0,
        "maxDrawdown": 0,
        "trades": 0,
        "avgReturn": 0,
        "profitFactor": 0,
        "wins": 0,
        "losses": 0
      }
    }
  },
  "insights": [],
  "status": "done",
  "createdAt": "2025-11-09T15:31:05.439Z",
  "completedAt": "2025-11-09T15:31:05.439Z",
  "error": null
}