{
  "runId": "run-1762748921062",
  "summary": {
    "runId": "run-1762748921062",
    "totalTrades": 0,
    "tradesCount": 0,
    "totalPnL": 0,
    "avgReturn": 0,
    "winRate": 0,
    "profitFactor": 0,
    "maxDrawdown": 0,
    "avgHoldingDays": 0,
    "missingCount": 2,
    "from": "2025-01-01",
    "to": "2025-01-02",
    "interval": "day",
    "mode": "mock",
    "strategyConfig": {
      "ema_short": 6,
      "ema_long": 53,
      "atr_mult": 0.95,
      "volumeFactor": 0.9
    },
    "swing10": {
      "successWithin10Days": 0,
      "failWithin10Days": 0,
      "expiredTrades": 0,
      "successRateWithin10Days": 0
    },
    "equityCurve": []
  },
  "perSymbol": {
    "S2": {
      "trades": [],
      "metrics": {
        "netPnl": 0,
        "winRate": 0,
        "maxDrawdown": 0,
        "trades": 0,
        "avgReturn": 0,
        "profitFactor": 0,
        "wins": 0,
        "losses": 0
      }
    },
    "S5": {
      "trades": [],
      "metrics": {
        "netPnl": 0,
        "winRate": 0,
        "maxDrawdown": 0,
        "trades": 0,
        "avgReturn": 0,
        "profitFactor": 0,
        "wins": 0,
        "losses": 0
      }
    }
  },
  "insights": [],
  "status": "done",
  "createdAt": "2025-11-10T04:28:41.079Z",
  "completedAt": "2025-11-10T04:28:41.079Z",
  "error": null
}